reviewId,userName,content,score,thumbsUpCount,reviewCreatedVersion,at,replyContent,repliedAt
65b78f83-22ca-4164-a602-5f17b737f3d3,Guhan Kantha,Very entertaining app and very secure. I have Galaxy S24 Ultra and it works amazing no lags. Love the layout and Live videos are cool. Very secure especially when signing in it does amazing from preventing unauthorized logins. I really like search results! On Insta if you search something up it comes random things but TikTok it gives you videos that are exactly the topic of the search. Also summarizes other videos and give me summarized info like searching Galaxy S24 vs iPhone 16,5,187,37.9.3,2024-12-30 22:43:21,,
4f90f221-f0d8-48ac-990a-868fa2766171,Karmen Owens,"An awesome app, cool people, some bad some good, great editors, and great algorithm, though if one think needs fixing it's gotta be the search, it kicks me out of what I searched after I click one video and then close out of it. But overall it's good, I hope it doesn't get banned forever :(",5,12,38.2.3,2025-01-18 20:56:56,,
1d88ecbb-5150-4509-a79b-f8d81f732705,Jessica H,"Love the algorithm and the contents shown based on my interest, easy search function, relevant and interesting reels, great platform for discovering new creators. Doesn't push famous people content and I could spend hours on the app. Great app, better than all the other platform I've tried.",5,50,38.3.3,2025-02-04 09:16:01,Thanks for the amazing review! We love hearing about your experience and appreciate you taking the time to review us!,2025-02-04 18:32:43
80190caa-6a61-48a4-b32a-5acc629b3f41,Jes Isenberg,"I have learned more on this app than I've ever learned elsewhere. The way in which we are able to easily access information, and communicate with people around the world has been amazing, and in my opinion, crucial. The ease in which we have been able to find communities, and sooth depression? Essential. The comment sections? Hilarious. The entertainment of it all has been the cherry on top of the best and most informative social media platform that has ever existed. Thank you to the creators!",5,27,38.2.3,2025-01-18 06:02:18,Thanks for the great review! We love to hear that!,2025-02-04 23:20:33
7a1386dd-fa11-4877-952a-79e564ac6f72,Justin Ahsaruk,My experience with TikTok has been awesome meeting a ton of people along the way. Including tons of celebrities I thought I would never have a chance to meet and get to know. Plus growing artists and pages. All the special people I have met on this app. Even to be made a moderator cause people harassing so much on persons page. He added me as that and it help me grow . He ask me and I didn't want to decline. It made me search for who I was. (Please don't shut this app down) 🙏🥲 Thank you all!,5,31,37.9.3,2025-01-11 23:38:57,,
